{
  "schema": {
    "name": "csx.render-prior-art-catalog",
    "major": 1,
    "minor": 0,
    "producerVersion": "render-prior-art-integration-1"
  },
  "catalogId": "prior-art-catalog-skyrim-vr-1.4.15-csx-3.19-vr",
  "catalogRevision": 2,
  "target": {
    "engine": {
      "product": "Skyrim VR",
      "runtime": "1.4.15",
      "executableName": "SkyrimVR.exe",
      "executableVersion": "1.4.15.0",
      "executableSha256": "6961efb4f4775a307b0fc9a3d637542c1e090be207d3b09467eab216b7f87971"
    },
    "shaderSystem": {
      "name": "CSX",
      "version": "3.19-VR",
      "sourceRevision": "b223489b6b2afb5441409b3e17e826ff964efb50",
      "manifestPath": "docs/development/shader-analysis/shader-manifest.generated.json",
      "manifestSha256": "e6f6f0bdbf38916f43fe1975363e29ea2eea234f101c1f3eb1146c9f89c68522"
    }
  },
  "sources": [
    {
      "id": "prior-source-0001",
      "name": "Nukem9/skyrimse-test",
      "repository": "https://github.com/Nukem9/skyrimse-test",
      "revision": {
        "branch": "master",
        "commitSha": "328916305165a46c4e4b527735bbcfd46b09a0ca"
      },
      "accessedAtUtc": "2026-08-28T00:00:00Z",
      "evidenceClass": "static-reconstruction",
      "engineApplicability": [
        {
          "product": "Skyrim Special Edition",
          "runtime": null,
          "basis": "unknown"
        }
      ],
      "shaderSystemApplicability": [
        {
          "name": "Skyrim Special Edition native shaders",
          "version": null,
          "revision": "328916305165a46c4e4b527735bbcfd46b09a0ca",
          "basis": "inferred"
        }
      ],
      "lineageRefs": [],
      "license": null,
      "notes": "The README identifies Skyrim Special Edition but does not pin an executable runtime. Treat reconstructed code and tables as version-sensitive candidate evidence, not as Skyrim VR truth.",
      "extensions": {}
    },
    {
      "id": "prior-source-0002",
      "name": "aers/skyrim-rendering",
      "repository": "https://github.com/aers/skyrim-rendering",
      "revision": {
        "branch": "main",
        "commitSha": "328ab57699353a901ebf51580d567819fc49cb46"
      },
      "accessedAtUtc": "2026-08-28T00:00:00Z",
      "evidenceClass": "static-reconstruction",
      "engineApplicability": [
        {
          "product": "Skyrim Special Edition / Anniversary Edition",
          "runtime": "1.6.1170",
          "basis": "declared"
        }
      ],
      "shaderSystemApplicability": [],
      "lineageRefs": [],
      "license": null,
      "notes": "The project describes itself as reconstructed functions for understanding accumulation and culling. Its plugin declaration explicitly limits compatibility to RUNTIME_SSE_1_6_1170.",
      "extensions": {}
    },
    {
      "id": "prior-source-0003",
      "name": "aers/SSEShaderTools",
      "repository": "https://github.com/aers/SSEShaderTools",
      "revision": {
        "branch": "master",
        "commitSha": "4d235dc7861f62e04bd8b889f667a4d8d6c68fb8"
      },
      "accessedAtUtc": "2026-08-28T00:00:00Z",
      "evidenceClass": "tracked-source",
      "engineApplicability": [
        {
          "product": "Skyrim Special Edition",
          "runtime": null,
          "basis": "inferred"
        }
      ],
      "shaderSystemApplicability": [
        {
          "name": "SSE Shader Tools",
          "version": null,
          "revision": "4d235dc7861f62e04bd8b889f667a4d8d6c68fb8",
          "basis": "declared"
        }
      ],
      "lineageRefs": [],
      "license": null,
      "notes": "Origin repository for the shader-load replacement approach later ported to CommonLib NG and VR.",
      "extensions": {}
    },
    {
      "id": "prior-source-0004",
      "name": "alandtse/SSEShaderTools",
      "repository": "https://github.com/alandtse/SSEShaderTools",
      "revision": {
        "branch": "main",
        "commitSha": "731f1d126319eecaf0ed9178c8b77e22926cf3f9"
      },
      "accessedAtUtc": "2026-08-28T00:00:00Z",
      "evidenceClass": "tracked-source",
      "engineApplicability": [
        {
          "product": "Skyrim Special Edition / Anniversary Edition",
          "runtime": null,
          "basis": "declared"
        },
        {
          "product": "Skyrim VR",
          "runtime": null,
          "basis": "declared"
        }
      ],
      "shaderSystemApplicability": [
        {
          "name": "SSE Shader Tools CommonLib NG / VR port",
          "version": null,
          "revision": "731f1d126319eecaf0ed9178c8b77e22926cf3f9",
          "basis": "declared"
        }
      ],
      "lineageRefs": ["prior-source-0003"],
      "license": null,
      "notes": "The README explicitly distinguishes SSE/AE and VR releases and credits the VR offsets and shader port. Exact supported executable versions are not declared at this revision.",
      "extensions": {}
    },
    {
      "id": "prior-source-0005",
      "name": "CharmedBaryon/CommonLibSSE-NG",
      "repository": "https://github.com/CharmedBaryon/CommonLibSSE-NG",
      "revision": {
        "branch": "main",
        "commitSha": "b93280e832f263dbef44e44cbe2936622a02f91a"
      },
      "accessedAtUtc": "2026-08-28T00:00:00Z",
      "evidenceClass": "library-contract",
      "engineApplicability": [
        {
          "product": "Skyrim Special Edition",
          "runtime": "multiple",
          "basis": "declared"
        },
        {
          "product": "Skyrim Anniversary Edition",
          "runtime": "multiple",
          "basis": "declared"
        },
        {
          "product": "Skyrim VR",
          "runtime": "multiple",
          "basis": "declared"
        }
      ],
      "shaderSystemApplicability": [],
      "lineageRefs": [],
      "license": null,
      "notes": "CommonLibSSE NG explicitly supports SE, AE, and VR. Individual layouts, vtables, and relocations still require runtime-specific verification.",
      "extensions": {}
    },
    {
      "id": "prior-source-0006",
      "name": "community-shaders/skyrim-community-shaders",
      "repository": "https://github.com/community-shaders/skyrim-community-shaders",
      "revision": {
        "branch": "dev",
        "commitSha": "e6a6d82def967a4bb9a4e497db004451839a4c44"
      },
      "accessedAtUtc": "2026-08-28T00:00:00Z",
      "evidenceClass": "tracked-source",
      "engineApplicability": [
        {
          "product": "Skyrim Special Edition / Anniversary Edition",
          "runtime": null,
          "basis": "declared"
        }
      ],
      "shaderSystemApplicability": [
        {
          "name": "Community Shaders",
          "version": "dev",
          "revision": "e6a6d82def967a4bb9a4e497db004451839a4c44",
          "basis": "declared"
        }
      ],
      "lineageRefs": ["prior-source-0004"],
      "license": null,
      "notes": "This is upstream Community Shaders, not CSX 3.19-VR. Shared ancestry makes it valuable, but every implementation claim must be checked for fork divergence and VR-specific behaviour.",
      "extensions": {}
    },
    {
      "id": "prior-source-0007",
      "name": "Gistix/CreationEngineRaytracing",
      "repository": "https://github.com/Gistix/CreationEngineRaytracing",
      "revision": {
        "branch": "main",
        "commitSha": "ea6f80483ce457778efed863e1af869c05b77745"
      },
      "accessedAtUtc": "2026-08-28T00:00:00Z",
      "evidenceClass": "extension-architecture",
      "engineApplicability": [
        {
          "product": "Skyrim Special Edition / Anniversary Edition",
          "runtime": null,
          "basis": "declared"
        }
      ],
      "shaderSystemApplicability": [
        {
          "name": "Creation Engine Raytracing with Community Shaders",
          "version": null,
          "revision": "ea6f80483ce457778efed863e1af869c05b77745",
          "basis": "declared"
        }
      ],
      "lineageRefs": ["prior-source-0006"],
      "license": null,
      "notes": "Its RenderGraph models the extension's own NVRHI passes and resources. It is useful design prior art but is not evidence of Skyrim's native execution graph.",
      "extensions": {}
    }
  ],
  "claims": [
    {
      "id": "prior-claim-0001",
      "sourceRef": "prior-source-0001",
      "statement": "The reconstructed Special Edition batch renderer organizes work around BeginPass, EndPass, RenderBatches, pass groups, active pass lists, and immediate render-pass submission.",
      "locators": [
        {
          "path": "skyrim64_test/src/patches/TES/BSBatchRenderer.cpp",
          "symbol": "BSBatchRenderer::BeginPass / EndPass / RenderBatches",
          "url": "https://github.com/Nukem9/skyrimse-test/blob/328916305165a46c4e4b527735bbcfd46b09a0ca/skyrim64_test/src/patches/TES/BSBatchRenderer.cpp"
        }
      ],
      "domains": ["batch-rendering", "shader-selection"],
      "targetAssessment": {
        "status": "partially-corroborated",
        "confidence": "high",
        "rationale": "Skyrim VR 1.4.15 now has exact BSBatchRenderer class/layout evidence and identified RenderActivePassRange, RenderBatches, and SetupAndDrawPass functions, while captures independently observe technique setup nested beneath render-pass boundaries. BeginPass/EndPass and the reconstruction's exact pass-list control flow remain version-specific and unverified.",
        "spotChecks": [
          {
            "id": "spot-check-0001",
            "status": "partial",
            "method": "Compare the prior-art batch boundaries with the existing bounded Skyrim VR render-pass and technique event ordering.",
            "evidenceRefs": ["evidence-0001"],
            "result": "The high-level nesting agrees; exact functions, layouts, and pass-list semantics remain version-specific and unverified."
          },
          {
            "id": "spot-check-0006",
            "status": "partial",